Match	Team	Result points	Match status	Opposition strength	Regional strength	Ranking points
Amplistan vs. Bestrudia (friendly)\nResult: 1–2	Amplistan\nBestrudia	0\n3	1.0\n1.0	0.50\n1.98	0.94\n0.94	0\n558
Amplistan vs. Bestrudia (friendly)\nResult: 1–1	Amplistan\nBestrudia	1\n1	1.0\n1.0	0.50\n1.98	0.94\n0.94	47\n186
Amplistan vs. Bestrudia (World Cup finals)\nResult: 2–1	Amplistan\nBestrudia	3\n0	4.0\n4.0	0.50\n1.98	0.94\n0.94	564\n0
Amplistan vs. Bestrudia (World Cup finals)\nResult: 1–1 (Bestrudia wins on penalties)	Amplistan\nBestrudia	1\n2	4.0\n4.0	0.50\n1.98	0.94\n0.94	188\n1488
Amplistan vs. Conesto (friendly)\nResult: 1–2	Amplistan\nConesto	0\n3	1.0\n1.0	1.61\n1.98	0.99\n0.99	0\n588
Conesto vs. Delphiz (Continental cup qualifiers)\nResult: 4–0	Conesto\nDelphiz	3\n0	2.5\n2.5	1.70\n1.61	0.96\n0.96	1224\n0
Conesto vs. Delphiz (Continental cup qualifiers)\nResult: 0–1	Conesto\nDelphiz	0\n3	2.5\n2.5	1.70\n1.61	0.96\n0.96	0\n1159
Conesto vs. Amplistan (World Cup finals)\nResult: 0–0 (Amplistan wins on penalties)	Conesto\nAmplistan	1\n2	4.0\n4.0	1.98\n1.61	0.99\n0.99	784\n1275
